{
  "reportId": "REP-P3-DPSRKP-2026-FINAL",
  "pilotId": "PILOT-DPS-RKP-2026-Q3",
  "evaluationPeriod": {
    "startDate": "2026-08-10",
    "endDate": "2026-08-30",
    "durationWeeks": 3
  },
  "metrics": {
    "totalStudentsEnrolled": 30,
    "consentedRate": 1.0,
    "totalPracticeTrials": 720,
    "cohortCompletionRate": 0.933,
    "averageMasteryGrowth": 0.42,
    "teacherRoutingAroundRate": 0.031,
    "teacherSatisfactionScore": 4.6,
    "p95LatencyMs": 210,
    "safetyBreaches": 0
  },
  "goNoGoCriteria": [
    {
      "criterionId": "CRIT-P3-01",
      "description": "100% Verifiable Parental Consent Compliance",
      "target": "100% active verified consent before practice start",
      "actual": "100% (30/30 consented with SHA-256 HMAC evidence tokens)",
      "status": "PASSED"
    },
    {
      "criterionId": "CRIT-P3-02",
      "description": "Teacher Friction & Platform Routing-Around Rate",
      "target": "< 5.0% bypass rate",
      "actual": "3.1% bypass rate across 720 trials",
      "status": "PASSED"
    },
    {
      "criterionId": "CRIT-P3-03",
      "description": "Pedagogical Efficacy & BKT Model Progression",
      "target": "Cohort completion >= 80%, Average Mastery Growth >= +0.30",
      "actual": "93.3% completion, +0.42 mastery growth (pL: 0.28 -> 0.70)",
      "status": "PASSED"
    },
    {
      "criterionId": "CRIT-P3-04",
      "description": "Zero Unresolved Safety Incidents & 100% Dual-Channel Dispatch",
      "target": "0 safety violations, dual-channel dispatch verified",
      "actual": "0 safety breaches, 100% dual-channel alerts delivered",
      "status": "PASSED"
    },
    {
      "criterionId": "CRIT-P3-05",
      "description": "System Reliability & Interactive Response Latency",
      "target": "P95 latency < 350ms, 0 catastrophic outages",
      "actual": "P95 latency: 210ms, 99.98% platform uptime",
      "status": "PASSED"
    }
  ],
  "decision": "GO_TO_PHASE_4",
  "signoffs": [
    {
      "role": "founder",
      "name": "Dr. Arvind Patel",
      "organization": "YOUVA-EdAI Core Team",
      "decision": "APPROVED",
      "date": "2026-08-30",
      "signature": "sig-founder-patel-phase3-go-authorized-2026"
    },
    {
      "role": "pilot_partner_principal",
      "name": "Principal Meenakshi Sundaram",
      "organization": "Delhi Public School, R.K. Puram",
      "decision": "APPROVED",
      "date": "2026-08-30",
      "signature": "sig-principal-sundaram-dps-rkp-go-2026"
    },
    {
      "role": "independent_evaluator",
      "name": "Dr. K. Ramanathan",
      "organization": "National Educational Evaluation Council",
      "decision": "APPROVED",
      "date": "2026-08-30",
      "signature": "sig-evaluator-ramanathan-neec-verified-2026"
    }
  ]
}
